{"$schema":"https://json-schema.org/draft/2020-12/schema","$id":"https://prax.local/schemas/visual-lesson/v1","title":"Prax Visual Lesson","type":"object","additionalProperties":false,"required":["schema_version","lesson_id","lesson_version","objective","states","actions","hints","static_fallback","grader"],"properties":{"schema_version":{"const":"prax.visual-lesson/v1"},"lesson_id":{"type":"string","pattern":"^[a-z0-9][a-z0-9-]{2,63}$"},"lesson_version":{"type":"string","pattern":"^\\d+\\.\\d+\\.\\d+$"},"objective":{"type":"string","minLength":1},"states":{"type":"array","minItems":1,"items":{"type":"object","additionalProperties":false,"required":["id","label","content"],"properties":{"id":{"type":"string","pattern":"^[a-z0-9][a-z0-9-]{2,63}$"},"label":{"type":"string","minLength":1},"content":{"type":"string","minLength":1}}}},"actions":{"type":"array","items":{"type":"object","additionalProperties":false,"required":["id","label"],"properties":{"id":{"type":"string","pattern":"^[a-z0-9][a-z0-9-]{2,63}$"},"label":{"type":"string","minLength":1}}}},"hints":{"type":"array","items":{"type":"string","minLength":1}},"static_fallback":{"type":"array","minItems":1,"items":{"type":"object","additionalProperties":false,"required":["state_id","content"],"properties":{"state_id":{"type":"string","pattern":"^[a-z0-9][a-z0-9-]{2,63}$"},"content":{"type":"string","minLength":1}}}},"grader":{"type":"object","additionalProperties":false,"required":["kind","accepted"],"properties":{"kind":{"type":"string","minLength":1},"accepted":{"type":"array"}}},"component_versions":{"type":"object","additionalProperties":{"type":"string"}},"transfer":{"type":"object"}}}
