{"schema_version":"prax.visual-lesson/v1","lesson_id":"lost-update-lab","lesson_version":"1.0.0","objective":"Interleave two read-modify-write operations and explain a lost update causally.","states":[{"id":"read","label":"Read","content":"Each actor reads the same starting value."},{"id":"interleave","label":"Interleave","content":"The writes can overwrite one another."},{"id":"compare","label":"Compare","content":"Timeline and final state expose the lost update."},{"id":"transfer","label":"Transfer","content":"Classify a new schedule with or without synchronization."}],"actions":[{"id":"previous","label":"Previous"},{"id":"next","label":"Next"},{"id":"reset","label":"Reset"}],"hints":["Write the cached value beside each actor.","Ask whether both writes include both increments."],"static_fallback":[{"state_id":"read","content":"Read value."},{"state_id":"interleave","content":"Interleave operations."},{"state_id":"compare","content":"Compare timeline and final state."},{"state_id":"transfer","content":"Classify a new schedule."}],"grader":{"kind":"structural","accepted":[]},"component_versions":{"state-stepper":"1.0.0","compare-views":"1.0.0","hint-engine":"1.0.0","receipt-panel":"1.0.0"}}
