{"schema_version":"prax.visual-lesson/v1","lesson_id":"lean-proof-state","lesson_version":"1.0.0","objective":"Read a preverified proof-state sequence without running a theorem prover in the learner artifact.","states":[{"id":"goal","label":"Goal","content":"⊢ a + 0 = a"},{"id":"rewrite","label":"Rewrite","content":"Apply the right-identity theorem."},{"id":"closed","label":"Closed","content":"No goals remain."}],"actions":[{"id":"previous","label":"Previous"},{"id":"next","label":"Next"},{"id":"reset","label":"Reset"}],"hints":["Look at the shape of the goal.","The proof-state export records the theorem step."],"static_fallback":[{"state_id":"goal","content":"Goal: a + 0 = a."},{"state_id":"rewrite","content":"Rewrite with right identity."},{"state_id":"closed","content":"Closed goal."}],"grader":{"kind":"host-tutor","accepted":[]},"component_versions":{"state-stepper":"1.0.0","hint-engine":"1.0.0","receipt-panel":"1.0.0"}}
