{"schema_version":"prax.visual-lesson/v1","lesson_id":"python-floating-point","lesson_version":"1.0.0","objective":"Predict, compare, explain, and transfer binary floating-point representation error.","states":[{"id":"predict","label":"Predict","content":"Will 0.1 + 0.2 equal 0.3 exactly? Commit first."},{"id":"represent","label":"Represent","content":"A finite decimal can be a repeating binary fraction."},{"id":"compare","label":"Compare","content":"The evaluated result is 0.30000000000000004 on common IEEE-754 implementations."},{"id":"transfer","label":"Transfer","content":"Solve a fresh decimal-boundary case without the answer."}],"actions":[{"id":"previous","label":"Previous"},{"id":"next","label":"Next"},{"id":"reset","label":"Reset"}],"hints":["Write a prediction before stepping.","Compare decimal intent, stored approximation, and result.","Explain the repeating binary fraction."],"static_fallback":[{"state_id":"predict","content":"Predict first."},{"state_id":"represent","content":"Inspect representation."},{"state_id":"compare","content":"Compare result."},{"state_id":"transfer","content":"Solve a fresh case."}],"grader":{"kind":"exact","accepted":[]},"component_versions":{"state-stepper":"1.0.0","parameter-lab":"1.0.0","compare-views":"1.0.0","hint-engine":"1.0.0","receipt-panel":"1.0.0"},"transfer":{"item_id":"float-transfer","prompt":"What happens for 0.7 + 0.1?"}}
