{"schema_version":"prax.visual-lesson/v1","lesson_id":"rubiks-move-lab","lesson_version":"1.0.0","objective":"Apply legal cube moves and synchronize notation, permutation, and spatial views.","states":[{"id":"start","label":"Solved cube","content":"All 54 stickers are in their solved color groups."},{"id":"move","label":"Legal move","content":"Apply U, R, F, D, L, or B with optional 2 or prime."},{"id":"compare","label":"Compare views","content":"Notation, permutation, and spatial index describe one state."},{"id":"transfer","label":"Transfer","content":"Predict the invariant after a fresh legal sequence."}],"actions":[{"id":"previous","label":"Previous"},{"id":"next","label":"Next"},{"id":"reset","label":"Reset"}],"hints":["Check notation against the legal grammar.","Count stickers rather than relying on color alone."],"static_fallback":[{"state_id":"start","content":"Solved state."},{"state_id":"move","content":"Legal move grammar."},{"state_id":"compare","content":"Synchronized views."},{"state_id":"transfer","content":"Fresh sequence."}],"grader":{"kind":"structural","accepted":[]},"component_versions":{"state-stepper":"1.0.0","compare-views":"1.0.0","hint-engine":"1.0.0","receipt-panel":"1.0.0"}}
